{"api_version":1,"builtins":["source.qqnt","transport.lan"],"entry_points":[{"group":"ohmymeme.plugins.v1","name":"source.qqnt","value":"ohmymeme_plugin_qqnt:create_plugin"},{"group":"ohmymeme.plugins.v1","name":"source.telegram","value":"ohmymeme_plugin_telegram:create_plugin"},{"group":"ohmymeme.plugins.v1","name":"source.douyin","value":"ohmymeme_plugin_douyin:create_plugin"},{"group":"ohmymeme.plugins.v1","name":"source.wechat","value":"ohmymeme_plugin_wechat:create_plugin"},{"group":"ohmymeme.plugins.v1","name":"sync.ftp","value":"ohmymeme_plugin_sync_ftp:create_plugin"},{"group":"ohmymeme.plugins.v1","name":"sync.s3","value":"ohmymeme_plugin_sync_s3:create_plugin"},{"group":"ohmymeme.plugins.v1","name":"sync.r2","value":"ohmymeme_plugin_sync_r2:create_plugin"},{"group":"ohmymeme.plugins.v1","name":"sync.webdav","value":"ohmymeme_plugin_sync_webdav:create_plugin"},{"group":"ohmymeme.plugins.v1","name":"transport.lan","value":"ohmymeme_plugin_lan:create_plugin"}],"expected":{"quarantined":[],"sources":{"source.douyin":"entry_point","source.qqnt":"builtin","source.telegram":"entry_point","source.wechat":"entry_point","sync.ftp":"entry_point","sync.r2":"entry_point","sync.s3":"entry_point","sync.webdav":"entry_point","transport.lan":"builtin"}},"load":["source.qqnt","source.telegram"],"start":[]}
